[
  {
    "color_sampling": "RGB",
    "component_depth": 8,
    "frame_width": 720,
    "frame_height": 400,
    "grain_rate": {
      "numerator": 70
    }
  },
  {
    "color_sampling": "RGB",
    "component_depth": 8,
    "frame_width": 640,
    "frame_height": 480,
    "grain_rate": {
      "numerator": 60
    }
  },
  {
    "color_sampling": "RGB",
    "component_depth": 8,
    "frame_width": 640,
    "frame_height": 480,
    "grain_rate": {
      "numerator": 67
    }
  },
  {
    "color_sampling": "RGB",
    "component_depth": 8,
    "frame_width": 640,
    "frame_height": 480,
    "grain_rate": {
      "numerator": 72
    }
  },
  {
    "color_sampling": "RGB",
    "component_depth": 8,
    "frame_width": 640,
    "frame_height": 480,
    "grain_rate": {
      "numerator": 75
    }
  },
  {
    "color_sampling": "RGB",
    "component_depth": 8,
    "frame_width": 800,
    "frame_height": 600,
    "grain_rate": {
      "numerator": 56
    }
  },
  {
    "color_sampling": "RGB",
    "component_depth": 8,
    "frame_width": 800,
    "frame_height": 600,
    "grain_rate": {
      "numerator": 60
    }
  },
  {
    "color_sampling": "RGB",
    "component_depth": 8,
    "frame_width": 800,
    "frame_height": 600,
    "grain_rate": {
      "numerator": 72
    }
  },
  {
    "color_sampling": "RGB",
    "component_depth": 8,
    "frame_width": 800,
    "frame_height": 600,
    "grain_rate": {
      "numerator": 75
    }
  },
  {
    "color_sampling": "RGB",
    "component_depth": 8,
    "frame_width": 832,
    "frame_height": 624,
    "grain_rate": {
      "numerator": 75
    }
  },
  {
    "color_sampling": "RGB",
    "component_depth": 8,
    "frame_width": 1024,
    "frame_height": 768,
    "grain_rate": {
      "numerator": 60
    }
  },
  {
    "color_sampling": "RGB",
    "component_depth": 8,
    "frame_width": 1024,
    "frame_height": 768,
    "grain_rate": {
      "numerator": 70
    }
  },
  {
    "color_sampling": "RGB",
    "component_depth": 8,
    "frame_width": 1024,
    "frame_height": 768,
    "grain_rate": {
      "numerator": 75
    }
  },
  {
    "color_sampling": "RGB",
    "component_depth": 8,
    "frame_width": 1280,
    "frame_height": 1024,
    "grain_rate": {
      "numerator": 75
    }
  },
  {
    "color_sampling": "RGB",
    "component_depth": 8,
    "frame_width": 1152,
    "frame_height": 870,
    "grain_rate": {
      "numerator": 75
    }
  }
]